Measure,Metric,Metric_Weight,Metric_Description,Extraction_Rule,Evaluation_Rule,Extraction_Rule_value,Score
MaintenanceFrequency,MatchMaintenanceFreqRequested,9,Checks that the requested maintenance frequency by the user matches the declared maintenance frequency,"{'type': 'xpath', 'source': 'dataset-metadata', 'rule': '//gmd:MD_Metadata //gmd:identificationInfo//gmd:MD_DataIdentification//gmd:resourceMaintenance//gmd:MD_MaintenanceInformation//gmd:maintenanceAndUpdateFrequency//gmd:MD_MaintenanceFrequencyCode/@codeListValue', 'value': 'text'}","{'type': 'comparison', 'referenceValue': 'continual', 'operator': 'is', 'description': 'Should return true if matches user request of maintenance requency. Should be implemented when requests on dahsboard can be personnalized.'}",continual,5
MeanValuePosUncertainties,MeanValuePosUncertainties,5,Mean value of positionnal uncertainty of the dataset,"{'type': 'xpath', 'source': 'dataset-metadata', 'rule': '//gmd:PositionalAccuracy//gmd:AbsolutePositionalAccuracy//gmd:MeanValuePositionalUncertainties', 'value': 'text'}","{'type': 'range', 'minimum': 0, 'maximum': 0.8, 'description': 'Mean value of positionnal uncertainty should be between 0m and 0.8m (user request)'}",0.02,5
RelativeVerticalError,RelativeVerticalError,5,"A comparison of the data (measured) and the control (true). Calculation method of the Relative LE (Rel LE90): see ISO19157-3, Table D.59","{'type': 'xpath', 'source': 'dataset-metadata', 'rule': '//gmd:PositionalAccuracy//gmd:RelativePositionalAccuracy//gmd:RelativeVerticalError', 'value': 'text'}","{'type': 'range', 'minimum': 0, 'maximum': 0.9, 'description': 'The vertical relative error should be between x and x (user request)'}",0.05,5
RelativeHorizontalError,RelativeHorizontalError,5,"A comparison of the data (measured) and the control (true). Calculation method of the Relative LE (Rel CE90): see ISO19157-3, Table D.60","{'type': 'xpath', 'source': 'dataset-metadata', 'rule': '//gmd:PositionalAccuracy//gmd:RelativePositionalAccuracy//gmd:RelativeHorizontalError', 'value': 'text'}","{'type': 'range', 'minimum': 0, 'maximum': 0.9, 'description': 'The horizontal relative error should be between x and x (user request)'}",0.001,5
CircularSD,CircularSD,5,"Radius describing a circle, in which the true point location lies with the probability of a normal distribution at 39,4 % (see ISO19157-3, Table D.49)","{'type': 'xpath', 'source': 'dataset-metadata', 'rule': '//gmd:PositionalAccuracy//gmd:GriddedPositionalAccuracy//gmd:CircularSD', 'value': 'text'}","{'type': 'range', 'minimum': 0, 'maximum': 0.9, 'description': 'The circular standard deviation should be between x and x (user request)'}",0.03,5
RMSErrorPlanimetry,RMSEPlanimetry,5,"Radius of a circle around the given point, in which the true value lies with probability P [ISO 19157-3:2021].s","{'type': 'xpath', 'source': 'dataset-metadata', 'rule': '//gmd:PositionalAccuracy//gmd:GriddedPositionalAccuracy//gmd:RMSEPlanimetry', 'value': 'text'}","{'type': 'comparison', 'referenceValue': 20, 'operator': '<', 'description': 'The circular standard deviation should be under 20m (user request)'}",21,4
equivalentScale,equivalentScale,5,Level of detail expressed as the scale denominator of a comparable hardcopy map or chart. Each spatialResoultion element must contain either an equivalent scale or a distance but not both,"{'type': 'xpath', 'source': 'dataset-metadata', 'rule': '//gmd:identificationInfo[1]//gmd:spatialResolution//gmd:equivalentScale//gmd:denominator', 'value': 'text'}","{'type': 'range', 'minimum': 490, 'maximum': 510, 'description': 'Map scale should be between 1/4900 and 1/5100 (user request).'}",500,5
distance,Distance,5,Ground sample distance. Each 'spatialResoultion' element must contain either an equivalent scale or a distance but not both,"{'type': 'xpath', 'source': 'dataset-metadata', 'rule': '//gmd:identificationInfo[1]//gmd:spatialResolution//gmd:distance', 'value': 'text'}","{'type': 'range', 'minimum': 15, 'maximum': 20, 'description': 'Distance should be between 15-20m (user request).'}",25.0,1
